[
  {
    "authority": "Illinois State Geological Survey (ISGS), Prairie Research Institute, Univ. of Illinois",
    "base_url": "https://data.isgs.illinois.edu/arcgis/rest/services",
    "http_status": 200,
    "id": "IL-ISGS-ARCGIS",
    "layers_or_datasets": [
      "Geology/Bedrock_Geology_500K_2005 (MapServer)",
      "Geology/Drift_Thickness (MapServer)",
      "Geology/NRCS_SSURGO_Soils_Dataset (FeatureServer)",
      "Elevation/IL_DEM_301FT (MapServer)",
      "Imagery/AerialImageryTiles (MapServer)"
    ],
    "notes": "Server 10.91; folders: Coastal, Elevation, Geology, Hydrology, Imagery, Lake_Michigan_Shoreline, Landcover, Reference, Space, Utilities. Also the backend the Illinois Geospatial Data Clearinghouse catalog points its Services tabs to. NOTE: strategy docs cited Illinois East as EPSG:3405; epsg.io shows 3405 is VN-2000/UTM 48N (Vietnam) \u2014 correct Illinois East (ftUS) is EPSG:3435.",
    "provenance_label": "STATE-BEST",
    "service_type": "arcgis-rest",
    "state": "IL",
    "target_crs": "EPSG:3435 (NAD83 / Illinois East (ftUS)); services also publish Web Mercator",
    "verification_evidence": "curl -s -o /dev/null -w '%{http_code}' --max-time 30 'https://data.isgs.illinois.edu/arcgis/rest/services?f=json'  # -> 200",
    "verification_status": "verified",
    "verified_at": "2026-09-26T11:15:27Z"
  },
  {
    "authority": "State of Illinois (data.illinois.gov)",
    "base_url": "https://data.illinois.gov/",
    "http_status": 200,
    "id": "IL-OPENDATA-SOCRATA",
    "layers_or_datasets": [
      "Portal base only \u2014 no CKAN API present"
    ],
    "notes": "Portal is Socrata-powered; the CKAN paths /api/3/action/status_show and /api/3/action/package_search both return 404 \u2014 Illinois no longer runs CKAN here. Recorded as the Socrata portal, not CKAN.",
    "provenance_label": "STATE-BEST",
    "service_type": "opendata",
    "state": "IL",
    "target_crs": null,
    "verification_evidence": "curl -s -o /dev/null -w '%{http_code}' --max-time 20 'https://data.illinois.gov/'  # -> 200",
    "verification_status": "verified",
    "verified_at": "2026-09-26T11:15:27Z"
  },
  {
    "authority": "Kentucky Division of Geographic Information (DGI) / KyGeoNet",
    "base_url": "https://kygisserver.ky.gov/arcgis/rest/services",
    "http_status": 200,
    "id": "KY-GEONET-MAP",
    "layers_or_datasets": [
      "WGS84WM_Services/Ky_24K_NHD_Blueline_Streams_WGS84WM (FeatureServer)",
      "WGS84WM_Services/Ky_Scenic_Byways_WGS84WM (MapServer)",
      "WGS84WM_Services/Ky_Public_Hunting_Areas_WGS84WM (MapServer)",
      "WGS84WM_Services/Ky_Recreational_Trails_WGS84WM (MapServer)",
      "WGS84WM_Services/Ky_StateForests_WGS84WM (MapServer)"
    ],
    "notes": "Server 10.91; 170 services under WGS84WM_Services; no login required. Canonical per official KyGeoNet docs (kygeonet.ky.gov).",
    "provenance_label": "STATE-BEST",
    "service_type": "arcgis-rest",
    "state": "KY",
    "target_crs": "EPSG:3088 (NAD83 / Kentucky Single Zone) for KY1Z services; WGS84WM_* services are Web Mercator",
    "verification_evidence": "curl -s -o /dev/null -w '%{http_code}' --max-time 30 'https://kygisserver.ky.gov/arcgis/rest/services?f=json'  # -> 200",
    "verification_status": "verified",
    "verified_at": "2026-09-26T11:15:27Z"
  },
  {
    "authority": "Kentucky DGI / KyGeoNet (KyFromAbove program)",
    "base_url": "https://kyraster.ky.gov/arcgis/rest/services",
    "http_status": 200,
    "id": "KY-GEONET-RASTER",
    "layers_or_datasets": [
      "ElevationServices/Ky_DEM_KYAPED_2FT_Phase2 (ImageServer)",
      "ElevationServices/Ky_DEM_KYAPED_2FT_Phase2_Hillshade (ImageServer)",
      "ImageServices/ statewide leaf-on/leaf-off imagery (ImageServer)",
      "ThematicServices/ thematic rasters (ImageServer)"
    ],
    "notes": "Canonical image-services URL per official KyGeoNet docs. Elevation products are KYAPED LiDAR-derived. kyfromabove.ky.gov itself is a web portal, not a REST API \u2014 its data services are these endpoints.",
    "provenance_label": "STATE-BEST",
    "service_type": "arcgis-rest",
    "state": "KY",
    "target_crs": "EPSG:3088 (NAD83 / Kentucky Single Zone) for KY1Z services; *_WGS84WM variants are Web Mercator",
    "verification_evidence": "curl -s -o /dev/null -w '%{http_code}' --max-time 30 'https://kyraster.ky.gov/arcgis/rest/services?f=json'  # -> 200",
    "verification_status": "verified",
    "verified_at": "2026-09-26T11:15:27Z"
  },
  {
    "authority": "Indiana Geographic Information Office (IGIO) / IndianaMap",
    "base_url": "https://gisdata.in.gov/server/rest/services",
    "http_status": 200,
    "id": "IN-IGIO-ARCGIS",
    "layers_or_datasets": [
      "Best_Available_Flood_Hazard_Layer (MapServer)",
      "Hosted/Parcel_Boundaries_of_Indiana_2025 (FeatureServer)",
      "Annual_Precipitation_* (MapServer)",
      "DNR / IDEM / IDHS / DOR_Utilities framework folders"
    ],
    "notes": "Server 11.5. Canonical per official in.gov IndianaMap web-services guide (no login). Parcel FeatureServer and BAFM MapServer individually verified 200.",
    "provenance_label": "STATE-BEST",
    "service_type": "arcgis-rest",
    "state": "IN",
    "target_crs": "EPSG:2966 (NAD83 / Indiana West (ftUS)) for project area; BAFM service native spatial ref observed as wkid 26916 (NAD83 / UTM 16N)",
    "verification_evidence": "curl -s -o /dev/null -w '%{http_code}' --max-time 30 'https://gisdata.in.gov/server/rest/services?f=json'  # -> 200",
    "verification_status": "verified",
    "verified_at": "2026-09-26T11:15:27Z"
  },
  {
    "authority": "Indiana Geographic Information Office (IGIO)",
    "base_url": "https://di-ingov.img.arcgis.com/arcgis/rest/services/DynamicWebMercator/Indiana_Current_Imagery/ImageServer",
    "http_status": 200,
    "id": "IN-IGIO-IMAGERY",
    "layers_or_datasets": [
      "Indiana_Current_Imagery (ImageServer) \u2014 current statewide orthoimagery mosaic"
    ],
    "notes": "Visual/change-detection evidence only. Corroborated in repo docs/DATA-SOURCE-CATALOG.md.",
    "provenance_label": "STATE-BEST",
    "service_type": "arcgis-rest",
    "state": "IN",
    "target_crs": "Web Mercator (DynamicWebMercator service path)",
    "verification_evidence": "curl -s -o /dev/null -w '%{http_code}' --max-time 30 'https://di-ingov.img.arcgis.com/arcgis/rest/services/DynamicWebMercator/Indiana_Current_Imagery/ImageServer?f=json'  # -> 200",
    "verification_status": "verified",
    "verified_at": "2026-09-26T11:15:27Z"
  },
  {
    "authority": "FEMA (National Flood Hazard Layer)",
    "base_url": "https://hazards.fema.gov/arcgis/rest/services/public/NFHL/MapServer",
    "http_status": 200,
    "id": "FED-FEMA-NFHL",
    "layers_or_datasets": [
      "28 - Flood Hazard Zones",
      "16 - Base Flood Elevations",
      "3 - FIRM Panels",
      "34 - LOMAs",
      "23 - Levees"
    ],
    "notes": "The /arcgis/rest/services/public/NFHL/ path is the live one; the alternate https://hazards.fema.gov/nfhl/rest/services/public/NFHL/MapServer returns 404 (verified). Matches repo docs/OPEN-WORLD-3D-TWIN-AND-HECRAS-MESH-v1.0.md.",
    "provenance_label": "FEMA-EFFECTIVE",
    "service_type": "arcgis-rest",
    "state": "FEDERAL",
    "target_crs": "Native NFHL (NAD83); consume as-published",
    "verification_evidence": "curl -s -o /dev/null -w '%{http_code}' --max-time 30 'https://hazards.fema.gov/arcgis/rest/services/public/NFHL/MapServer?f=json'  # -> 200",
    "verification_status": "verified",
    "verified_at": "2026-09-26T11:15:27Z"
  },
  {
    "authority": "USGS Water Services (NWIS)",
    "base_url": "https://waterservices.usgs.gov/nwis/iv/",
    "http_status": 200,
    "id": "FED-USGS-WATER-IV",
    "layers_or_datasets": [
      "iv (instantaneous values) \u2014 verified live JSON for site 03378500 (Wabash River at New Harmony, IN)",
      "dv (daily values), site, stat, gwlevels available at same base"
    ],
    "notes": "Returned a real timeSeriesResponse for 03378500, not an error stub. Project gauge station. Provisional-data qualifier rules from repo docs still apply; no datum conversion without validated gage-zero.",
    "provenance_label": "OBSERVED",
    "service_type": "opendata",
    "state": "FEDERAL",
    "target_crs": null,
    "verification_evidence": "curl -s -o /dev/null -w '%{http_code}' --max-time 25 'https://waterservices.usgs.gov/nwis/iv/?format=json&sites=03378500'  # -> 200",
    "verification_status": "verified",
    "verified_at": "2026-09-26T11:15:27Z",
    "verify_url": "https://waterservices.usgs.gov/nwis/iv/?format=json&sites=03378500"
  },
  {
    "authority": "State of Illinois (data.illinois.gov)",
    "base_url": "https://data.illinois.gov/api/3/action/status_show",
    "http_status": 404,
    "id": "IL-CKAN-API",
    "layers_or_datasets": [],
    "notes": "CKAN action API returns 404; portal is Socrata-powered. Do not use as a CKAN endpoint.",
    "provenance_label": "STATE-BEST",
    "service_type": "ckan",
    "state": "IL",
    "target_crs": null,
    "verification_evidence": "curl -s -o /dev/null -w '%{http_code}' 'https://data.illinois.gov/api/3/action/status_show'  # -> 404",
    "verification_status": "unverifiable",
    "verified_at": "2026-09-26T11:15:27Z"
  },
  {
    "authority": "Illinois Geospatial Data Clearinghouse (clearinghouse.isgs.illinois.edu)",
    "base_url": "https://clearinghouse.isgs.illinois.edu/",
    "http_status": null,
    "id": "IL-CLEARINGHOUSE-REST",
    "layers_or_datasets": [],
    "notes": "The Clearinghouse is a Drupal data catalog with no REST services directory of its own; per-dataset Services tabs link to data.isgs.illinois.edu/arcgis/rest/services (IL-ISGS-ARCGIS, verified).",
    "provenance_label": "STATE-BEST",
    "service_type": "opendata",
    "state": "IL",
    "target_crs": "EPSG:3435 (NAD83 / Illinois East (ftUS))",
    "verification_evidence": "n/a \u2014 catalog site, no services directory to probe",
    "verification_status": "unverifiable",